{
 "school_id": "sch_dwarka_02",
 "kind": "now",
 "target_time": "2026-10-12T01:00:00Z",
 "generated_at": "2026-10-12T01:30:00Z",
 "source": "sample",
 "inputs": {
  "wind": "sample",
  "fires": "sample"
 },
 "indicative": true,
 "method": "Indicative single-level (120 m) wind back-trajectory, midpoint integration; fires within corridor_km of the path, detected between 24 h before and 3 h after the parcel passed. Not a dispersion model.",
 "params": {
  "hours_back": 24,
  "step_minutes": 15,
  "corridor_km": 25,
  "frp_threshold_mw": 100,
  "min_fires": 3,
  "wind_level": "120m"
 },
 "origin": {
  "lat": 28.5823,
  "lon": 77.05
 },
 "path": [
  {
   "time": "2026-10-12T01:00:00Z",
   "lat": 28.5823,
   "lon": 77.05,
   "wind_speed_ms": 3.0,
   "wind_from_deg": 328.8
  },
  {
   "time": "2026-10-12T00:00:00Z",
   "lat": 28.662,
   "lon": 76.9953,
   "wind_speed_ms": 2.75,
   "wind_from_deg": 329.0
  },
  {
   "time": "2026-10-11T23:00:00Z",
   "lat": 28.7362,
   "lon": 76.9445,
   "wind_speed_ms": 2.6,
   "wind_from_deg": 328.9
  },
  {
   "time": "2026-10-11T22:00:00Z",
   "lat": 28.8074,
   "lon": 76.895,
   "wind_speed_ms": 2.56,
   "wind_from_deg": 328.4
  },
  {
   "time": "2026-10-11T21:00:00Z",
   "lat": 28.8786,
   "lon": 76.8445,
   "wind_speed_ms": 2.62,
   "wind_from_deg": 327.9
  },
  {
   "time": "2026-10-11T20:00:00Z",
   "lat": 28.9525,
   "lon": 76.7908,
   "wind_speed_ms": 2.8,
   "wind_from_deg": 327.2
  },
  {
   "time": "2026-10-11T19:00:00Z",
   "lat": 29.0322,
   "lon": 76.7314,
   "wind_speed_ms": 3.08,
   "wind_from_deg": 326.6
  },
  {
   "time": "2026-10-11T18:00:00Z",
   "lat": 29.1199,
   "lon": 76.6645,
   "wind_speed_ms": 3.43,
   "wind_from_deg": 326.1
  },
  {
   "time": "2026-10-11T17:00:00Z",
   "lat": 29.2177,
   "lon": 76.5889,
   "wind_speed_ms": 3.87,
   "wind_from_deg": 326.1
  },
  {
   "time": "2026-10-11T16:00:00Z",
   "lat": 29.327,
   "lon": 76.5038,
   "wind_speed_ms": 4.29,
   "wind_from_deg": 325.6
  },
  {
   "time": "2026-10-11T15:00:00Z",
   "lat": 29.4468,
   "lon": 76.4086,
   "wind_speed_ms": 4.71,
   "wind_from_deg": 325.0
  },
  {
   "time": "2026-10-11T14:00:00Z",
   "lat": 29.5766,
   "lon": 76.3035,
   "wind_speed_ms": 5.11,
   "wind_from_deg": 324.8
  },
  {
   "time": "2026-10-11T13:00:00Z",
   "lat": 29.717,
   "lon": 76.1909,
   "wind_speed_ms": 5.47,
   "wind_from_deg": 325.6
  },
  {
   "time": "2026-10-11T12:00:00Z",
   "lat": 29.8677,
   "lon": 76.0741,
   "wind_speed_ms": 5.76,
   "wind_from_deg": 326.5
  },
  {
   "time": "2026-10-11T11:00:00Z",
   "lat": 30.0269,
   "lon": 75.9553,
   "wind_speed_ms": 5.95,
   "wind_from_deg": 327.7
  },
  {
   "time": "2026-10-11T10:00:00Z",
   "lat": 30.1923,
   "lon": 75.8379,
   "wind_speed_ms": 6.04,
   "wind_from_deg": 329.2
  },
  {
   "time": "2026-10-11T09:00:00Z",
   "lat": 30.3617,
   "lon": 75.725,
   "wind_speed_ms": 6.04,
   "wind_from_deg": 331.2
  },
  {
   "time": "2026-10-11T08:00:00Z",
   "lat": 30.5321,
   "lon": 75.6194,
   "wind_speed_ms": 5.89,
   "wind_from_deg": 332.5
  },
  {
   "time": "2026-10-11T07:00:00Z",
   "lat": 30.6984,
   "lon": 75.5211,
   "wind_speed_ms": 5.64,
   "wind_from_deg": 333.7
  },
  {
   "time": "2026-10-11T06:00:00Z",
   "lat": 30.8585,
   "lon": 75.4316,
   "wind_speed_ms": 5.34,
   "wind_from_deg": 335.1
  },
  {
   "time": "2026-10-11T05:00:00Z",
   "lat": 31.0122,
   "lon": 75.3537,
   "wind_speed_ms": 5.01,
   "wind_from_deg": 337.6
  },
  {
   "time": "2026-10-11T04:00:00Z",
   "lat": 31.1575,
   "lon": 75.2862,
   "wind_speed_ms": 4.64,
   "wind_from_deg": 339.0
  },
  {
   "time": "2026-10-11T03:00:00Z",
   "lat": 31.2924,
   "lon": 75.2271,
   "wind_speed_ms": 4.26,
   "wind_from_deg": 340.0
  },
  {
   "time": "2026-10-11T02:00:00Z",
   "lat": 31.4163,
   "lon": 75.1749,
   "wind_speed_ms": 3.88,
   "wind_from_deg": 340.5
  },
  {
   "time": "2026-10-11T01:00:00Z",
   "lat": 31.5303,
   "lon": 75.1284,
   "wind_speed_ms": 3.57,
   "wind_from_deg": 341.0
  }
 ],
 "upwind_from_deg": 328.3,
 "matched_fires": [
  {
   "lat": 29.3596,
   "lon": 76.281,
   "frp_mw": 8.24,
   "acq_time": "2026-10-10T20:30:00Z",
   "satellite": "N20",
   "distance_km": 15.7,
   "hours_before_arrival": 9.9,
   "district": "Jind",
   "state": "Haryana"
  },
  {
   "lat": 29.71,
   "lon": 76.5014,
   "frp_mw": 3.28,
   "acq_time": "2026-10-10T20:30:00Z",
   "satellite": "N21",
   "distance_km": 24.2,
   "hours_before_arrival": 11.1,
   "district": "Kaithal",
   "state": "Haryana"
  },
  {
   "lat": 29.7277,
   "lon": 76.436,
   "frp_mw": 6.42,
   "acq_time": "2026-10-10T20:30:00Z",
   "satellite": "N",
   "distance_km": 20.1,
   "hours_before_arrival": 11.3,
   "district": "Kaithal",
   "state": "Haryana"
  },
  {
   "lat": 29.7697,
   "lon": 76.3188,
   "frp_mw": 17.71,
   "acq_time": "2026-10-11T07:55:00Z",
   "satellite": "N",
   "distance_km": 13.5,
   "hours_before_arrival": 11.9,
   "district": "Kaithal",
   "state": "Haryana"
  },
  {
   "lat": 29.8217,
   "lon": 76.2876,
   "frp_mw": 3.51,
   "acq_time": "2026-10-10T20:30:00Z",
   "satellite": "N21",
   "distance_km": 14.3,
   "hours_before_arrival": 12.2,
   "district": "Kaithal",
   "state": "Haryana"
  },
  {
   "lat": 30.1464,
   "lon": 75.7363,
   "frp_mw": 11.3,
   "acq_time": "2026-10-10T20:30:00Z",
   "satellite": "N21",
   "distance_km": 11.0,
   "hours_before_arrival": 15.0,
   "district": "Sangrur",
   "state": "Punjab"
  },
  {
   "lat": 30.2883,
   "lon": 75.9472,
   "frp_mw": 2.92,
   "acq_time": "2026-10-10T20:30:00Z",
   "satellite": "N",
   "distance_km": 14.5,
   "hours_before_arrival": 15.2,
   "district": "Sangrur",
   "state": "Punjab"
  },
  {
   "lat": 30.2275,
   "lon": 75.8355,
   "frp_mw": 1.3,
   "acq_time": "2026-10-11T07:55:00Z",
   "satellite": "N20",
   "distance_km": 1.8,
   "hours_before_arrival": 15.2,
   "district": "Sangrur",
   "state": "Punjab"
  },
  {
   "lat": 30.3036,
   "lon": 75.9318,
   "frp_mw": 6.71,
   "acq_time": "2026-10-11T07:55:00Z",
   "satellite": "N",
   "distance_km": 14.0,
   "hours_before_arrival": 15.3,
   "district": "Sangrur",
   "state": "Punjab"
  },
  {
   "lat": 30.2972,
   "lon": 75.8953,
   "frp_mw": 14.33,
   "acq_time": "2026-10-11T07:55:00Z",
   "satellite": "N",
   "distance_km": 10.7,
   "hours_before_arrival": 15.3,
   "district": "Sangrur",
   "state": "Punjab"
  },
  {
   "lat": 30.3022,
   "lon": 75.7689,
   "frp_mw": 7.3,
   "acq_time": "2026-10-11T07:55:00Z",
   "satellite": "N",
   "distance_km": 0.4,
   "hours_before_arrival": 15.6,
   "district": "Sangrur",
   "state": "Punjab"
  }
 ],
 "by_district": [
  {
   "district": "Sangrur",
   "district_hi": "संगरूर",
   "state": "Punjab",
   "state_hi": "पंजाब",
   "fire_count": 6,
   "frp_total_mw": 43.9
  },
  {
   "district": "Kaithal",
   "district_hi": "कैथल",
   "state": "Haryana",
   "state_hi": "हरियाणा",
   "fire_count": 4,
   "frp_total_mw": 30.9
  },
  {
   "district": "Jind",
   "district_hi": "जींद",
   "state": "Haryana",
   "state_hi": "हरियाणा",
   "fire_count": 1,
   "frp_total_mw": 8.2
  }
 ],
 "fire_count": 11,
 "frp_total_mw": 83.0,
 "smoke_likely": false,
 "headline": {
  "en": "Smoke unlikely now: the wind is from the north-west and passed 11 farm fires, too few for a strong smoke signal; local sources likely dominate.",
  "hi": "अभी धुएँ की संभावना कम: हवा उत्तर-पश्चिम से आ रही है और रास्ते में 11 खेतों की आग मिली, जो धुएँ के बड़े असर के लिए कम है; प्रदूषण मुख्यतः स्थानीय होने की संभावना है।"
 }
}
