{
 "school_id": "sample-dwarka",
 "kind": "forecast",
 "target_time": "2026-10-12T08:30:00Z",
 "generated_at": "2026-10-12T01:30:00Z",
 "source": "sample",
 "inputs": {
  "wind": "sample",
  "fires": "sample"
 },
 "indicative": true,
 "method": "Indicative single-level (120 m) wind back-trajectory, midpoint integration; fires within corridor_km of the path, detected between 24 h before and 3 h after the parcel passed. Not a dispersion model.",
 "params": {
  "hours_back": 24,
  "step_minutes": 15,
  "corridor_km": 25,
  "frp_threshold_mw": 100,
  "min_fires": 3,
  "wind_level": "120m"
 },
 "origin": {
  "lat": 28.59,
  "lon": 77.05
 },
 "path": [
  {
   "time": "2026-10-12T08:30:00Z",
   "lat": 28.59,
   "lon": 77.05,
   "wind_speed_ms": 5.6,
   "wind_from_deg": 323.3
  },
  {
   "time": "2026-10-12T07:30:00Z",
   "lat": 28.7346,
   "lon": 76.9307,
   "wind_speed_ms": 5.4,
   "wind_from_deg": 324.9
  },
  {
   "time": "2026-10-12T06:30:00Z",
   "lat": 28.8756,
   "lon": 76.8207,
   "wind_speed_ms": 5.13,
   "wind_from_deg": 326.4
  },
  {
   "time": "2026-10-12T05:30:00Z",
   "lat": 29.011,
   "lon": 76.7208,
   "wind_speed_ms": 4.81,
   "wind_from_deg": 328.0
  },
  {
   "time": "2026-10-12T04:30:00Z",
   "lat": 29.1392,
   "lon": 76.6321,
   "wind_speed_ms": 4.45,
   "wind_from_deg": 329.6
  },
  {
   "time": "2026-10-12T03:30:00Z",
   "lat": 29.2596,
   "lon": 76.5546,
   "wind_speed_ms": 4.08,
   "wind_from_deg": 331.4
  },
  {
   "time": "2026-10-12T02:30:00Z",
   "lat": 29.3704,
   "lon": 76.4864,
   "wind_speed_ms": 3.69,
   "wind_from_deg": 332.1
  },
  {
   "time": "2026-10-12T01:30:00Z",
   "lat": 29.4709,
   "lon": 76.4259,
   "wind_speed_ms": 3.33,
   "wind_from_deg": 332.4
  },
  {
   "time": "2026-10-12T00:30:00Z",
   "lat": 29.5622,
   "lon": 76.3713,
   "wind_speed_ms": 3.04,
   "wind_from_deg": 332.5
  },
  {
   "time": "2026-10-11T23:30:00Z",
   "lat": 29.6463,
   "lon": 76.321,
   "wind_speed_ms": 2.84,
   "wind_from_deg": 332.4
  },
  {
   "time": "2026-10-11T22:30:00Z",
   "lat": 29.7262,
   "lon": 76.2731,
   "wind_speed_ms": 2.76,
   "wind_from_deg": 332.5
  },
  {
   "time": "2026-10-11T21:30:00Z",
   "lat": 29.8052,
   "lon": 76.2255,
   "wind_speed_ms": 2.77,
   "wind_from_deg": 332.3
  },
  {
   "time": "2026-10-11T20:30:00Z",
   "lat": 29.886,
   "lon": 76.1761,
   "wind_speed_ms": 2.9,
   "wind_from_deg": 331.8
  },
  {
   "time": "2026-10-11T19:30:00Z",
   "lat": 29.9714,
   "lon": 76.1226,
   "wind_speed_ms": 3.13,
   "wind_from_deg": 331.2
  },
  {
   "time": "2026-10-11T18:30:00Z",
   "lat": 30.0643,
   "lon": 76.063,
   "wind_speed_ms": 3.45,
   "wind_from_deg": 330.6
  },
  {
   "time": "2026-10-11T17:30:00Z",
   "lat": 30.1664,
   "lon": 75.9957,
   "wind_speed_ms": 3.83,
   "wind_from_deg": 330.1
  },
  {
   "time": "2026-10-11T16:30:00Z",
   "lat": 30.2794,
   "lon": 75.9197,
   "wind_speed_ms": 4.25,
   "wind_from_deg": 329.7
  },
  {
   "time": "2026-10-11T15:30:00Z",
   "lat": 30.404,
   "lon": 75.8348,
   "wind_speed_ms": 4.68,
   "wind_from_deg": 329.5
  },
  {
   "time": "2026-10-11T14:30:00Z",
   "lat": 30.5409,
   "lon": 75.7418,
   "wind_speed_ms": 5.11,
   "wind_from_deg": 329.6
  },
  {
   "time": "2026-10-11T13:30:00Z",
   "lat": 30.6891,
   "lon": 75.6412,
   "wind_speed_ms": 5.48,
   "wind_from_deg": 329.7
  },
  {
   "time": "2026-10-11T12:30:00Z",
   "lat": 30.847,
   "lon": 75.5343,
   "wind_speed_ms": 5.79,
   "wind_from_deg": 330.1
  },
  {
   "time": "2026-10-11T11:30:00Z",
   "lat": 31.0151,
   "lon": 75.4252,
   "wind_speed_ms": 6.07,
   "wind_from_deg": 331.8
  },
  {
   "time": "2026-10-11T10:30:00Z",
   "lat": 31.1921,
   "lon": 75.3175,
   "wind_speed_ms": 6.23,
   "wind_from_deg": 333.1
  },
  {
   "time": "2026-10-11T09:30:00Z",
   "lat": 31.3735,
   "lon": 75.2122,
   "wind_speed_ms": 6.25,
   "wind_from_deg": 334.1
  },
  {
   "time": "2026-10-11T08:30:00Z",
   "lat": 31.556,
   "lon": 75.1117,
   "wind_speed_ms": 6.19,
   "wind_from_deg": 336.0
  }
 ],
 "upwind_from_deg": 327.9,
 "matched_fires": [
  {
   "lat": 29.3035,
   "lon": 76.4177,
   "frp_mw": 19.09,
   "acq_time": "2026-10-11T20:25:00Z",
   "satellite": "N21",
   "distance_km": 9.4,
   "hours_before_arrival": 5.7,
   "district": "Jind",
   "state": "Haryana"
  },
  {
   "lat": 29.2742,
   "lon": 76.288,
   "frp_mw": 5.25,
   "acq_time": "2026-10-11T20:25:00Z",
   "satellite": "N20",
   "distance_km": 22.0,
   "hours_before_arrival": 6.0,
   "district": "Jind",
   "state": "Haryana"
  },
  {
   "lat": 29.7326,
   "lon": 76.5194,
   "frp_mw": 6.12,
   "acq_time": "2026-10-11T20:25:00Z",
   "satellite": "N",
   "distance_km": 21.4,
   "hours_before_arrival": 9.0,
   "district": "Kaithal",
   "state": "Haryana"
  },
  {
   "lat": 29.7023,
   "lon": 76.3032,
   "frp_mw": 14.92,
   "acq_time": "2026-10-11T20:25:00Z",
   "satellite": "N21",
   "distance_km": 1.4,
   "hours_before_arrival": 9.6,
   "district": "Kaithal",
   "state": "Haryana"
  },
  {
   "lat": 29.7388,
   "lon": 76.3909,
   "frp_mw": 7.75,
   "acq_time": "2026-10-11T20:25:00Z",
   "satellite": "N",
   "distance_km": 10.7,
   "hours_before_arrival": 9.6,
   "district": "Kaithal",
   "state": "Haryana"
  },
  {
   "lat": 29.7261,
   "lon": 76.2967,
   "frp_mw": 12.57,
   "acq_time": "2026-10-11T20:25:00Z",
   "satellite": "N",
   "distance_km": 2.0,
   "hours_before_arrival": 9.9,
   "district": "Kaithal",
   "state": "Haryana"
  },
  {
   "lat": 29.7712,
   "lon": 76.3888,
   "frp_mw": 9.12,
   "acq_time": "2026-10-11T20:25:00Z",
   "satellite": "N21",
   "distance_km": 12.2,
   "hours_before_arrival": 9.9,
   "district": "Kaithal",
   "state": "Haryana"
  },
  {
   "lat": 29.7697,
   "lon": 76.3188,
   "frp_mw": 17.71,
   "acq_time": "2026-10-11T07:55:00Z",
   "satellite": "N",
   "distance_km": 6.1,
   "hours_before_arrival": 10.2,
   "district": "Kaithal",
   "state": "Haryana"
  },
  {
   "lat": 29.8373,
   "lon": 76.375,
   "frp_mw": 13.31,
   "acq_time": "2026-10-11T20:25:00Z",
   "satellite": "N",
   "distance_km": 14.4,
   "hours_before_arrival": 10.6,
   "district": "Kaithal",
   "state": "Haryana"
  },
  {
   "lat": 29.8621,
   "lon": 76.3183,
   "frp_mw": 5.42,
   "acq_time": "2026-10-11T20:25:00Z",
   "satellite": "N",
   "distance_km": 10.9,
   "hours_before_arrival": 11.1,
   "district": "Kaithal",
   "state": "Haryana"
  },
  {
   "lat": 30.1464,
   "lon": 75.7363,
   "frp_mw": 11.3,
   "acq_time": "2026-10-10T20:30:00Z",
   "satellite": "N21",
   "distance_km": 22.7,
   "hours_before_arrival": 15.7,
   "district": "Sangrur",
   "state": "Punjab"
  },
  {
   "lat": 30.2275,
   "lon": 75.8355,
   "frp_mw": 1.3,
   "acq_time": "2026-10-11T07:55:00Z",
   "satellite": "N20",
   "distance_km": 9.9,
   "hours_before_arrival": 15.9,
   "district": "Sangrur",
   "state": "Punjab"
  },
  {
   "lat": 30.2883,
   "lon": 75.9472,
   "frp_mw": 2.92,
   "acq_time": "2026-10-10T20:30:00Z",
   "satellite": "N",
   "distance_km": 2.8,
   "hours_before_arrival": 16.0,
   "district": "Sangrur",
   "state": "Punjab"
  },
  {
   "lat": 30.3036,
   "lon": 75.9318,
   "frp_mw": 6.71,
   "acq_time": "2026-10-11T07:55:00Z",
   "satellite": "N",
   "distance_km": 2.4,
   "hours_before_arrival": 16.1,
   "district": "Sangrur",
   "state": "Punjab"
  },
  {
   "lat": 30.2972,
   "lon": 75.8953,
   "frp_mw": 14.33,
   "acq_time": "2026-10-11T07:55:00Z",
   "satellite": "N",
   "distance_km": 1.0,
   "hours_before_arrival": 16.2,
   "district": "Sangrur",
   "state": "Punjab"
  },
  {
   "lat": 30.3022,
   "lon": 75.7689,
   "frp_mw": 7.3,
   "acq_time": "2026-10-11T07:55:00Z",
   "satellite": "N",
   "distance_km": 11.2,
   "hours_before_arrival": 16.6,
   "district": "Sangrur",
   "state": "Punjab"
  }
 ],
 "by_district": [
  {
   "district": "Kaithal",
   "district_hi": "कैथल",
   "state": "Haryana",
   "state_hi": "हरियाणा",
   "fire_count": 8,
   "frp_total_mw": 86.9
  },
  {
   "district": "Sangrur",
   "district_hi": "संगरूर",
   "state": "Punjab",
   "state_hi": "पंजाब",
   "fire_count": 6,
   "frp_total_mw": 43.9
  },
  {
   "district": "Jind",
   "district_hi": "जींद",
   "state": "Haryana",
   "state_hi": "हरियाणा",
   "fire_count": 2,
   "frp_total_mw": 24.3
  }
 ],
 "fire_count": 16,
 "frp_total_mw": 155.1,
 "smoke_likely": true,
 "headline": {
  "en": "Smoke likely by 14:00: the air reaching school then will have passed over 16 farm fires, mostly in Kaithal (Haryana), Sangrur (Punjab) and Jind (Haryana).",
  "hi": "दोपहर 2 बजे तक धुएँ की संभावना: तब स्कूल पहुँचने वाली हवा 16 खेतों की आग के ऊपर से गुज़री होगी, ज़्यादातर कैथल (हरियाणा), संगरूर (पंजाब) और जींद (हरियाणा) में।"
 }
}
